"japanese","english","context","notes","jp_bytes","en_bytes","overflow"
"たこ焼型のホットケーキを作るのよ！/これなら、材料も機具も/そのまま使えるから。","Make takoyaki-shaped pancakes ! /This way, materials and tools/can be used as is.","Portrait: !p0000!e00","","78","81","3"
"たとえ話よ……。/ねぇ、!0は/どういうつもりなんだと思う？","It's a hypothetical.../Hey, what do you think /!0 intends?","Portrait: !p0503!e00","","56","58","2"
"そんなコトいって、/アメリカの方が好きなクセに！","Saying that,/even though you like America more !","Portrait: !p0000!e00","","47","48","1"
"そんな人には、/私、絶対に負けないわ。","I'll never lose /to someone like that.","Portrait: !p0000!e00","","37","38","1"
"たいやき/ラムネ/たこ焼","Taiyaki /Soda /Takoyaki","Portrait: !pffff!e00","","22","23","1"
