"japanese","english","context","notes","jp_bytes","en_bytes","overflow"
"いや、それはダメだ。/これは俺自身の問題だ。/お前には関係ない。","No, that won't do.  /This is my own problem.  /Nothing to do with you.","Portrait: !p1900!e00","","62","70","8"
"いや、/他の部が何をやるのか/調べてたんだ。","No, /I was checking what  /other clubs are doing.","Portrait: !p0600!e00","","42","49","7"
"いや、見てないけど……/何かあったのか？/そんなに慌てて。","No, I didn't see…  /Something happen?  /You're so flustered.","Portrait: !p0000!e00","","56","61","5"
"いや、いいよ。/そんな……","No, it's fine.  /That's ...","Portrait: !p0603!e00","","25","27","2"
"いやいや、こればかりは/いくら島津先生にも/教えられませんな！","No no, this is one thing  /even Shimazu-sensei  /can't teach !","Portrait: !p3003!e00","","60","62","2"
