"japanese","english","context","notes","jp_bytes","en_bytes","overflow"
"部室棟も、/いつもとは違う活気で溢れてるわね。","The club room building /is full of different energy than usual.","Portrait: !p1800!e00","","45","63","18"
"誰かに教えてもらう/下手も個性/練習あるのみ","Have someone teach/ Bad is also personality/ Only practice","Portrait: !pffff!e00","","42","58","16"
"進路指導室へよく来たな！/ここでは必殺技の種類を/ごっそり変更できるぞ！！","Welcome to Career Guidance Room! /Here you can change /special move types wholesale!!","Portrait: !p2800!e00","","72","85","13"
"英雄先生、捜し物ですか？","Eiyu-sensei, looking for something?","Portrait: !p0000!e00","","24","35","11"
"進路指導室に止まった","Stopped at Career Guidance Room","Portrait: !pffff!e00","","20","31","11"
"英雄先生、何悩んでるんですか？","Eiyu-sensei, what are you worried about?","Portrait: !p0000!e00","","30","40","10"
"誰かに会いたい時は、/そういう事を考えていると/出会いやすいかもね。","When you want to meet someone, /thinking about it /makes encounters easier.","Portrait: !p1801!e00","","66","75","9"
"誰だって後輩に慕われて、/悪い気はしないしね。","Anyone would be happy /to be admired by underclassmen.","Portrait: !p0000!e00","","45","54","9"
"誰に戦闘をしかけますか？","Who will you challenge to battle?","Portrait: !pffff!e00","","24","33","9"
"購買部へいらっしゃい。/よく来たわね。","Welcome to the school store. /Good to see you.","Portrait: !p2600!e00","","37","46","9"
"話がある。/少し付き合わないか？","I have something to say. /Come with me?","Portrait: !p1901!e00","","31","39","8"
"誰の!c05友好度!c07を上げますか？","Whose !c05Friendship!c07 will you raise?","Portrait: !pffff!e00","","32","40","8"
"誰の!c05友好度!c07を下げますか？","Whose !c05Friendship!c07 will you lower?","Portrait: !pffff!e00","","32","40","8"
"走って移動したり、/パラメータが増えるマスに止まったり、/戦闘に負けると減り……、","Running to move, or /stopping on parameter up spaces, or /losing battles decreases it...","Portrait: !p1800!e00","","80","88","8"
"足りねぇ……/この学園祭、何かが足りねぇ！！","Not enough... /this festival, something's missing!!","Portrait: !p2003!e00","","43","51","8"
"話をきく/見逃す/怒る","Listen/ Overlook/ Get angry","Portrait: !pffff!e00","","20","27","7"
"認めよう！","I acknowledge it!","Portrait: !p1901!e00","","10","17","7"
"誰に使いますか？","Who will you use it on?","Portrait: !pffff!e00","","16","23","7"
"購買部に止まった","Stopped at school store","Portrait: !pffff!e00","","16","23","7"
"見てよ、九郎。/プールに金魚が泳いでるよ。","Look, Kuro. /Goldfish are swimming in the pool.","Portrait: !p0000!e00","","41","47","6"
"誰だって後輩に慕われて、/悪い気はしないんじゃないかな？","Anyone would be happy /to be admired by underclassmen, right?","Portrait: !p0000!e00","","55","61","6"
"部室が狭いから、壁をぶち壊して/となりのバレー部の部室も/テニス部用にする用意をしてるんですぅ！","Club room is small, so breaking the wall /to make volleyball club room next door /tennis club's too!","Portrait: !p2401!e00","","94","100","6"
"誰の!c01単位!c07を強奪しますか？","Whose !c01Credits!c07 will you steal?","Portrait: !pffff!e00","","32","37","5"
"誰の!c03潜在能力!c07を下げますか？","Whose !c03Potential!c07 will you lower?","Portrait: !pffff!e00","","34","39","5"
"買ったんじゃなくて、もらったのよ。/後輩や他のクラスの女の子たちに！","Didn't buy, got it as a gift. /From underclassmen and other class girls!","Portrait: !p0500!e00","","67","72","5"
"誰の!c03根性!c07を下げますか？","Whose !c03GUTS!c07 will you lower?","Portrait: !pffff!e00","","30","34","4"
"赤い顔して、何いってんだ？","Red face, what are you saying?","Portrait: !p0000!e00","","26","30","4"
"赤い顔して、何いってんの？","Red face, what are you saying?","Portrait: !p0000!e00","","26","30","4"
"遠慮する/自分で直す/直してもらう","Decline/ Fix yourself/ Have it fixed","Portrait: !pffff!e00","","32","36","4"
"部室にしまいに行こうかと思ったんだが、/ちょっと忙しくてな……。","Was thinking of putting it in the club room, but /got a bit busy...","Portrait: !p0600!e00","","63","67","4"
"衣装がどうしたのよ？","What about the costume?","Portrait: !p0000!e00","","20","23","3"
"誰と戦いますか？","Who will you fight?","Portrait: !pffff!e00","","16","19","3"
"誰の!c03知力!c07を下げますか？","Whose !c03INT!c07 will you lower?","Portrait: !pffff!e00","","30","33","3"
"誰の!c04機嫌!c07を悪くしますか？","Whose !c04mood!c07 will you worsen?","Portrait: !pffff!e00","","32","35","3"
"調子にのって、/その子に、ヘンなことするんじゃないよ！","Don't get carried away /and do weird things to that kid!","Portrait: !p2303!e00","","53","56","3"
"部室棟の方に、/お化け屋敷がありましたよ。/そこに行ってみましょう！","In the club room building, /there's a haunted house. /Let's go there!","Portrait: !p0000!e00","","66","69","3"
"見てみろよ、九郎。/プールに金魚が泳いでるぞ。","Look, Kuro. /Goldfish are swimming in the pool.","Portrait: !p0000!e00","","45","47","2"
"誰に対する!c05友好度!c07を下げますか？","Whose !c05Friendship!c07 will you lower?","Portrait: !pffff!e00","","38","40","2"
"誰の!c03体力!c07を下げますか？","Whose !c03HP!c07 will you lower?","Portrait: !pffff!e00","","30","32","2"
"誰の!c04機嫌!c07を直しますか？","Whose !c04mood!c07 will you fix?","Portrait: !pffff!e00","","30","32","2"
"英雄先生にピッタリの趣味ですね/人は見かけによらないですね/『深山幽谷』って感じですね","Perfect hobby for Eiyu-sensei/ Don't judge by appearance/ Feels like 'deep mountains'","Portrait: !pffff!e00","","84","85","1"
"英雄先生！/俺に先生のツープラトン技を/伝授してください！","Eiyu-sensei! /Please teach me your Two-Platoon technique!","Portrait: !p0000!e00","","56","57","1"
"英雄先生！/私に先生のツープラトン技を/伝授してください！","Eiyu-sensei! /Please teach me your Two-Platoon technique!","Portrait: !p0000!e00","","56","57","1"
"行くんだろ？/キャンプファイアーにさ！","You're going, right? /To the campfire!","Portrait: !p0000!e00","","37","38","1"
"行くんでしょ？/キャンプファイアーに！","You're going, right? /To the campfire!","Portrait: !p0000!e00","","37","38","1"
"衣装がどうしたんだよ？","What about the costume?","Portrait: !p0000!e00","","22","23","1"
"言ったよ。/言った言った。/フフフ……。","I said it. /Said it said it. /Hehehe...","Portrait: !p0000!e00","","38","39","1"
"診察してあげる！","I'll examine you!","Portrait: !p1400!e00","","16","17","1"
"誰の!c03攻撃力!c07を下げますか？","Whose !c03ATK!c07 will you lower?","Portrait: !pffff!e00","","32","33","1"
"誰の!c03防御力!c07を下げますか？","Whose !c03DEF!c07 will you lower?","Portrait: !pffff!e00","","32","33","1"
"部室棟の方に、/お化け屋敷がありましたよ。/行ってみましょうよ！","In the club room building, /there's a haunted house. /Let's go!","Portrait: !p0000!e00","","62","63","1"
