"japanese","english","context","notes","jp_bytes","en_bytes","overflow"
"やっぱ、全部売りてェよな！/意地みてェなもんでよ！","I really wanna sell it all！/I'm stubborn like that！","Portrait: !p1000!e00","","49","53","4"
"やっぱり兄貴はスゴイよなー。","My brother is amazing after all.","Portrait: !p0400!e00","","28","32","4"
"やっぱり、何じゃい？","After all, what is it?","Portrait: !p1200!e00","","20","22","2"
"やっぱりヒマつぶしだったのか……。","It was just killing time after all…","Portrait: !p0000!e00","","34","36","2"
"やっぱりヒマつぶしだったのね……。","It was just killing time after all…","Portrait: !p0000!e00","","34","36","2"
