"japanese","english","context","notes","jp_bytes","en_bytes","overflow"
"じゃあ、少し聞いてもいい？/あの子のこと……どう思う？","So, can I ask? /What do you think of that kid...?","Portrait: !p0503!e00","","53","48","0"
"すまんな。/礼をいうぞ。","Sorry. /Thanks.","Portrait: !p1901!e00","","23","16","0"
"じゃあ、/剣道部と試合とかしたら、/勝つ自信はあります？","If you had a match /with kendo club, /confident you'd win?","Portrait: !p0000!e00","","54","54","0"
"じゃ、納豆は？","What about natto?","Portrait: !p0000!e00","","14","14","0"
"じゃあ、私そろそろ行くね。/お店のお手伝いに戻らなきゃ。/また一緒に見て回ろうね！","I should go now. /Need to get back to the shop. /Let's look around again!","Portrait: !p1101!e00","","80","72","0"
"すごいな。/俺の考えてることがわかるのか。","Amazing. /You get what I'm thinking.","Portrait: !p1900!e00","","41","36","0"
"すいません、隼人先生。/俺……献血は苦手なので、/辞退させてほしいんですが……","Sorry, Hayato-sensei. /I'm bad with blood donation, /could I decline...?","Portrait: !p0000!e00","","76","72","0"
"すいません、隼人先生。/私……献血は苦手なので、/辞退させてほしいんですが……","Sorry, Hayato-sensei. /I'm bad with blood donation, /could I decline...?","Portrait: !p0000!e00","","76","72","0"
